{
  "$schema": "https://json-schema.org/draft/2020-12/schema",
  "$id": "meta.schema.json",
  "title": "meta.json",
  "description": "Build metadata, coverage and provenance of one house directory",
  "type": "object",
  "additionalProperties": false,
  "required": [
    "schema_version",
    "house",
    "generatedAt",
    "legislatures",
    "coverage",
    "classification",
    "sources"
  ],
  "properties": {
    "schema_version": {
      "type": "integer",
      "const": 3
    },
    "house": {
      "type": "string",
      "enum": [
        "camara",
        "senado"
      ],
      "description": "The chamber the record belongs to; part of every key (door 3)"
    },
    "generatedAt": {
      "type": "string",
      "pattern": "^\\d{4}-\\d{2}-\\d{2}T\\d{2}:\\d{2}:\\d{2}Z$"
    },
    "legislatures": {
      "type": "array",
      "items": {
        "type": "object",
        "additionalProperties": false,
        "required": [
          "id",
          "start",
          "end",
          "sourceUrl"
        ],
        "properties": {
          "id": {
            "type": "integer",
            "minimum": 57
          },
          "start": {
            "type": "string",
            "pattern": "^\\d{4}-\\d{2}-\\d{2}$"
          },
          "end": {
            "type": "string",
            "pattern": "^\\d{4}-\\d{2}-\\d{2}$"
          },
          "sourceUrl": {
            "type": "string",
            "pattern": "^https://"
          }
        }
      }
    },
    "coverage": {
      "type": "array",
      "items": {
        "type": "object",
        "additionalProperties": false,
        "required": [
          "legislature",
          "through",
          "rollCalls",
          "unclassified",
          "members"
        ],
        "properties": {
          "legislature": {
            "type": "integer",
            "minimum": 57
          },
          "through": {
            "type": [
              "string",
              "null"
            ],
            "pattern": "^\\d{4}-\\d{2}-\\d{2}$",
            "description": "Date of the latest roll call"
          },
          "rollCalls": {
            "type": "object",
            "additionalProperties": false,
            "required": [
              "nominal",
              "secret",
              "symbolic"
            ],
            "properties": {
              "nominal": {
                "type": "integer",
                "minimum": 0
              },
              "secret": {
                "type": "integer",
                "minimum": 0
              },
              "symbolic": {
                "type": [
                  "integer",
                  "null"
                ],
                "minimum": 0,
                "description": "null when the house publishes no symbolic roll-call records (door 9)"
              }
            }
          },
          "unclassified": {
            "type": "integer",
            "minimum": 0
          },
          "members": {
            "type": "integer",
            "minimum": 0
          }
        }
      }
    },
    "classification": {
      "type": "object",
      "additionalProperties": false,
      "required": [
        "version"
      ],
      "properties": {
        "version": {
          "type": "integer",
          "minimum": 1
        }
      }
    },
    "sources": {
      "type": "array",
      "items": {
        "$ref": "#/$defs/source"
      }
    }
  },
  "$defs": {
    "source": {
      "type": "object",
      "additionalProperties": false,
      "required": [
        "file",
        "sourceUrl",
        "sha256",
        "bytes",
        "downloadedAt"
      ],
      "properties": {
        "file": {
          "type": "string"
        },
        "sourceUrl": {
          "type": "string",
          "pattern": "^https?://"
        },
        "sha256": {
          "type": "string",
          "pattern": "^[0-9a-f]{64}$"
        },
        "bytes": {
          "type": "integer",
          "minimum": 0
        },
        "downloadedAt": {
          "type": "string",
          "pattern": "^\\d{4}-\\d{2}-\\d{2}T\\d{2}:\\d{2}:\\d{2}Z$"
        }
      },
      "description": "One file read, as recorded in data/raw/manifest.json (AD-005)"
    }
  }
}
