{
  "classification": {
    "version": 1
  },
  "coverage": [
    {
      "legislature": 57,
      "members": 2,
      "rollCalls": {
        "nominal": 1,
        "secret": 0,
        "symbolic": null
      },
      "through": "2025-04-01",
      "unclassified": 1
    },
    {
      "legislature": 58,
      "members": 2,
      "rollCalls": {
        "nominal": 0,
        "secret": 0,
        "symbolic": null
      },
      "through": null,
      "unclassified": 0
    }
  ],
  "generatedAt": "2027-03-01T12:00:00Z",
  "house": "senado",
  "legislatures": [
    {
      "end": "2027-01-31",
      "id": 57,
      "sourceUrl": "https://dadosabertos.camara.leg.br/api/v2/legislaturas/57",
      "start": "2023-02-01"
    },
    {
      "end": "2031-01-31",
      "id": 58,
      "sourceUrl": "https://dadosabertos.camara.leg.br/api/v2/legislaturas/58",
      "start": "2027-02-01"
    }
  ],
  "schema_version": 3,
  "sources": [
    {
      "bytes": 0,
      "downloadedAt": "2027-03-01T12:00:00Z",
      "file": "votacao-2025.json",
      "sha256": "0000000000000000000000000000000000000000000000000000000000000000",
      "sourceUrl": "https://legis.senado.leg.br/dadosabertos/votacao?dataInicio=2025-04-01"
    }
  ]
}
